post_id,title,content,author,created_utc,score,upvote_ratio,num_comments,subreddit,url,permalink,is_self,link_flair_text,collected_at,full_text,preprocessed_text,auto_label,auto_label_id,label_confidence,label_agreement,textblob_prediction,vader_prediction,finbert_prediction,score_negative,score_neutral,score_positive
1nwfdfy,Seeking Guidance on Finding an Internship in Ethereum Development (remote).,,Melodic_Penalty_5306,2025-10-03 03:41:03,6,0.88,4,ethereum,/r/ethdev/comments/1nwfc12/seeking_guidance_on_finding_an_internship_in/,https://reddit.com/r/ethereum/comments/1nwfdfy/seeking_guidance_on_finding_an_internship_in/,False,,2025-10-10 15:07:33.360526,Seeking Guidance on Finding an Internship in Ethereum Development (remote). ,seeking guidance finding internship ethereum development remote,neutral,1,0.9303280711174011,1.0,neutral,neutral,neutral,0.00481284549459815,0.9303280711174011,0.06485910713672638
1nvc24r,Privacy Cluster Leadership Announcement | Ethereum Foundation Blog,,ligi,2025-10-01 22:55:24,24,0.94,0,ethereum,https://blog.ethereum.org/2025/10/01/privacy-cluster-leads,https://reddit.com/r/ethereum/comments/1nvc24r/privacy_cluster_leadership_announcement_ethereum/,False,,2025-10-10 15:07:33.360526,Privacy Cluster Leadership Announcement | Ethereum Foundation Blog ,privacy cluster leadership announcement ethereum foundation blog,neutral,1,0.9501906335353851,1.0,neutral,neutral,neutral,0.006808019708842039,0.9501906335353851,0.04300134629011154
1ntx1z8,Why the Future of Funding is Coordinated | Dev Tools Guild,,abcoathup,2025-09-30 06:08:09,8,0.75,0,ethereum,https://devtoolsguild.xyz/blog/coordinated-funding,https://reddit.com/r/ethereum/comments/1ntx1z8/why_the_future_of_funding_is_coordinated_dev/,False,Technology,2025-10-10 15:07:33.360526,Why the Future of Funding is Coordinated | Dev Tools Guild ,future funding coordinated dev tool guild,neutral,1,0.9287960827350616,1.0,neutral,neutral,neutral,0.004178544040769339,0.9287960827350616,0.0670253336429596
1nrrlm9,Fusaka upgrade testnet schedule,,abcoathup,2025-09-27 17:13:52,21,0.93,0,ethereum,https://blog.ethereum.org/2025/09/26/fusaka-testnet-announcement,https://reddit.com/r/ethereum/comments/1nrrlm9/fusaka_upgrade_testnet_schedule/,False,Technology,2025-10-10 15:07:33.360526,Fusaka upgrade testnet schedule ,fusaka upgrade testnet schedule,neutral,1,0.9676779210567474,1.0,neutral,neutral,neutral,0.019112417474389076,0.9676779210567474,0.013209653086960316
1nr24hd,Doots Podcast #126 at 2ET today featuring Obol Staking,,jtnichol,2025-09-26 21:00:26,25,0.82,6,ethereum,https://v.redd.it/gmxo2rqemirf1,https://reddit.com/r/ethereum/comments/1nr24hd/doots_podcast_126_at_2et_today_featuring_obol/,False,,2025-10-10 15:07:33.360526,Doots Podcast #126 at 2ET today featuring Obol Staking ,doots podcast 126 2et today featuring obol staking,neutral,1,0.9620349705219269,1.0,neutral,neutral,neutral,0.01595180481672287,0.9620349705219269,0.022013220936059952
1nkpp2v,"All Core Devs - Consensus (ACDC) #165: 🦓 Fusaka upgrade: Proposed schedule: Holešky Oct 1, Sepolia Oct 14, Hoodi Oct 28; BPO analysis: BPO 1: 10/15, BPO 2: 14/21 (target/max blobs); $2M audit contest; mainnet in December (at the earliest, depends on testing/audit)",,abcoathup,2025-09-19 07:57:07,18,0.88,0,ethereum,https://ethereum-magicians.org/t/all-core-devs-consensus-acdc-165-september-18-2025/25351/5,https://reddit.com/r/ethereum/comments/1nkpp2v/all_core_devs_consensus_acdc_165_fusaka_upgrade/,False,Protocol call,2025-10-10 15:07:33.360526,"All Core Devs - Consensus (ACDC) #165: 🦓 Fusaka upgrade: Proposed schedule: Holešky Oct 1, Sepolia Oct 14, Hoodi Oct 28; BPO analysis: BPO 1: 10/15, BPO 2: 14/21 (target/max blobs); $2M audit contest; mainnet in December (at the earliest, depends on testing/audit) ",core devs consensus acdc 165 fusaka upgrade proposed schedule holeky oct 1 sepolia oct 14 hoodi oct 28 bpo analysis bpo 1 1015 bpo 2 1421 targetmax blob $2m audit contest mainnet december earliest depends testingaudit,neutral,1,0.958165854215622,1.0,neutral,neutral,neutral,0.01777276210486889,0.958165854215622,0.0240614116191864
1niolvd,"Ethereum Inflation, Supply, Staking and Other Key Metrics | Sep 2025",,RealFlummi,2025-09-17 00:53:52,13,0.86,1,ethereum,https://peakd.com/eth/@dalz/ethereum-inflation-supply-staking-and-other-key-metrics-or-sep-2025,https://reddit.com/r/ethereum/comments/1niolvd/ethereum_inflation_supply_staking_and_other_key/,False,,2025-10-10 15:07:33.360526,"Ethereum Inflation, Supply, Staking and Other Key Metrics | Sep 2025 ",ethereum inflation supply staking key metric sep 2025,neutral,1,0.8835349678993225,1.0,neutral,neutral,neutral,0.009612745605409145,0.8835349678993225,0.10685230046510696
1ni3v11,Testing `eth_config` (allows comparing client config),,abcoathup,2025-09-16 08:08:39,2,0.6,0,ethereum,https://steel.ethereum.foundation/blog/blog_posts/2025-09-15_eth-config/,https://reddit.com/r/ethereum/comments/1ni3v11/testing_eth_config_allows_comparing_client_config/,False,Technology,2025-10-10 15:07:33.360526,Testing `eth_config` (allows comparing client config) ,testing ethconfig allows comparing client config,neutral,1,0.9435731172561646,1.0,neutral,neutral,neutral,0.004837363492697477,0.9435731172561646,0.051589492708444595
1nevvli,"All Core Devs - Execution (ACDE) #220; Fusaka upgrade testing & schedule, Glamsterdam upgrade non-headliner EIPs",,abcoathup,2025-09-12 13:29:13,18,0.88,0,ethereum,https://ethereum-magicians.org/t/all-core-devs-execution-acde-220-september-11-2025/25290/2,https://reddit.com/r/ethereum/comments/1nevvli/all_core_devs_execution_acde_220_fusaka_upgrade/,False,Protocol call,2025-10-10 15:07:33.360526,"All Core Devs - Execution (ACDE) #220; Fusaka upgrade testing & schedule, Glamsterdam upgrade non-headliner EIPs ",core devs execution acde 220 fusaka upgrade testing schedule glamsterdam upgrade nonheadliner eips,neutral,1,0.9715679287910461,1.0,neutral,neutral,neutral,0.012897533364593983,0.9715679287910461,0.01553451456129551
1o29y3e,If you had to pick only one,"If you could only pick one crypto to go “all in on”, which crypto currency would you choose? (Bitcoin excluded) 

Not asking for any investment advice I just am simply curious as to what everyone would pick if you could only pick one.",MeowditationStation,2025-10-09 23:03:58,10,0.76,56,cryptomarkets,https://www.reddit.com/r/CryptoMarkets/comments/1o29y3e/if_you_had_to_pick_only_one/,https://reddit.com/r/CryptoMarkets/comments/1o29y3e/if_you_had_to_pick_only_one/,True,Sentiment,2025-10-10 15:07:36.898388,"If you had to pick only one If you could only pick one crypto to go “all in on”, which crypto currency would you choose? (Bitcoin excluded) 

Not asking for any investment advice I just am simply curious as to what everyone would pick if you could only pick one.",pick one could pick one crypto go crypto currency would choose bitcoin excluded not asking investment advice simply curious everyone would pick could pick one,neutral,1,0.9205182185173035,1.0,neutral,neutral,neutral,0.03597120531499386,0.9205182185173035,0.043510564991831785
1o2ejv8,Altcoins vs BTC in 2025 – where’s the real opportunity?,"Been following the charts lately and I’m trying to figure out where the best upside is this year. BTC dominance is still pretty strong, but some altcoins look like they’re setting up for solid runs.

Do you see more potential in sticking with BTC right now, or are you positioning into certain alts?

Would love to hear how you’re playing it.",jeremiah406,2025-10-10 01:57:29,1,0.67,7,cryptomarkets,https://www.reddit.com/r/CryptoMarkets/comments/1o2ejv8/altcoins_vs_btc_in_2025_wheres_the_real/,https://reddit.com/r/CryptoMarkets/comments/1o2ejv8/altcoins_vs_btc_in_2025_wheres_the_real/,True,Discussion,2025-10-10 15:07:36.898388,"Altcoins vs BTC in 2025 – where’s the real opportunity? Been following the charts lately and I’m trying to figure out where the best upside is this year. BTC dominance is still pretty strong, but some altcoins look like they’re setting up for solid runs.

Do you see more potential in sticking with BTC right now, or are you positioning into certain alts?

Would love to hear how you’re playing it.",altcoins v btc 2025 wheres real opportunity following chart lately im trying figure best upside year btc dominance still pretty strong altcoins look like theyre setting solid run see potential sticking btc right positioning certain alt would love hear youre playing,positive,2,0.7405785415172577,1.0,positive,positive,positive,0.008496863767504692,0.2509246152043343,0.7405785415172577
1o258nm,Arthur Hayes says Trump and Xi are pumping Bitcoin harder than any halving ever could,"Arthur Hayes says Bitcoin’s bull run is now driven by Trump and Xi’s monetary policies, not the halving cycle.",CryptopolitanNews,2025-10-09 19:58:24,3,0.67,1,cryptomarkets,https://www.cryptopolitan.com/arthur-hayes-trump-xi-are-pumping-bitcoin/,https://reddit.com/r/CryptoMarkets/comments/1o258nm/arthur_hayes_says_trump_and_xi_are_pumping/,False,,2025-10-10 15:07:36.898388,"Arthur Hayes says Trump and Xi are pumping Bitcoin harder than any halving ever could Arthur Hayes says Bitcoin’s bull run is now driven by Trump and Xi’s monetary policies, not the halving cycle.",arthur hayes say trump xi pumping bitcoin harder halving ever could arthur hayes say bitcoins bull run driven trump xi monetary policy not halving cycle,neutral,1,0.9256591498851776,1.0,neutral,neutral,neutral,0.03570692241191864,0.9256591498851776,0.038633957505226135
1o2a5zw,Cardano price points for this bull run,What do you guys think it will hit or what are your sell targets? I’m planning on selling almost everything and will try to buy back next year. ,Several_Structure418,2025-10-09 23:12:00,1,0.53,12,cryptomarkets,https://www.reddit.com/r/CryptoMarkets/comments/1o2a5zw/cardano_price_points_for_this_bull_run/,https://reddit.com/r/CryptoMarkets/comments/1o2a5zw/cardano_price_points_for_this_bull_run/,True,,2025-10-10 15:07:36.898388,Cardano price points for this bull run What do you guys think it will hit or what are your sell targets? I’m planning on selling almost everything and will try to buy back next year. ,cardano price point bull run guy think hit sell target im planning selling almost everything try buy back next year,neutral,1,0.9520815312862396,1.0,neutral,neutral,neutral,0.01425574254244566,0.9520815312862396,0.03366272151470184
1o21lvd,Has the bull run ended?,"I have a feeling we hit the top this September. ETFs keep buying bitcoin and eth but we haven’t reached the high highs. 
Is it over chat?",CravingMind98,2025-10-09 16:42:54,0,0.42,40,cryptomarkets,https://www.reddit.com/r/CryptoMarkets/comments/1o21lvd/has_the_bull_run_ended/,https://reddit.com/r/CryptoMarkets/comments/1o21lvd/has_the_bull_run_ended/,True,Discussion,2025-10-10 15:07:36.898388,"Has the bull run ended? I have a feeling we hit the top this September. ETFs keep buying bitcoin and eth but we haven’t reached the high highs. 
Is it over chat?",bull run ended feeling hit top september etf keep buying bitcoin eth havent reached high high chat,positive,2,0.6912842613220215,1.0,positive,positive,positive,0.035668797142803674,0.2730469424664974,0.6912842613220215
1o1i98i,Best crypto allocation?,What do you consider the best crypto allocation? I have been in xrp only since 2017 then reinvested in 2021 and worked out well for me. Now looking to diversify.,Dkf8911,2025-10-09 01:14:44,1,0.67,13,cryptomarkets,https://www.reddit.com/r/CryptoMarkets/comments/1o1i98i/best_crypto_allocation/,https://reddit.com/r/CryptoMarkets/comments/1o1i98i/best_crypto_allocation/,True,STRATEGY,2025-10-10 15:07:36.898388,Best crypto allocation? What do you consider the best crypto allocation? I have been in xrp only since 2017 then reinvested in 2021 and worked out well for me. Now looking to diversify.,best crypto allocation consider best crypto allocation xrp since 2017 reinvested 2021 worked well looking diversify,positive,2,0.7622763434410096,1.0,positive,positive,positive,0.0046128081157803535,0.23311083074808123,0.7622763434410096
1o15quk,Deutsche Bank: Bitcoin “Likely” to Feature on Central Bank Balance Sheets by 2030,,IceNo26,2025-10-08 16:25:42,2,0.75,0,cryptomarkets,https://www.sandmark.com/news/top-news/deutsche-bank-bitcoin-likely-feature-central-bank-balance-sheets-2030?utm_medium=referral&utm_source=redbot&utm_campaign=redbot-ww-en-brand,https://reddit.com/r/CryptoMarkets/comments/1o15quk/deutsche_bank_bitcoin_likely_to_feature_on/,False,NEWS,2025-10-10 15:07:36.898388,Deutsche Bank: Bitcoin “Likely” to Feature on Central Bank Balance Sheets by 2030 ,deutsche bank bitcoin likely feature central bank balance sheet 2030,neutral,1,0.9691041111946106,1.0,neutral,neutral,neutral,0.011404868215322495,0.9691041111946106,0.019490988925099373
1o0exam,"The Great Divergence: Bitcoin Hits All-Time High at $126K as US Government Grinds to a Halt. The current shutdown, an unexpected catalyst, has forced many players to look beyond volatility and see what Bitcoin truly represents.",,sylsau,2025-10-07 20:34:13,4,0.75,1,cryptomarkets,https://inbitcoinwetrust.substack.com/p/the-great-divergence-bitcoin-hits,https://reddit.com/r/CryptoMarkets/comments/1o0exam/the_great_divergence_bitcoin_hits_alltime_high_at/,False,NEWS,2025-10-10 15:07:36.899388,"The Great Divergence: Bitcoin Hits All-Time High at $126K as US Government Grinds to a Halt. The current shutdown, an unexpected catalyst, has forced many players to look beyond volatility and see what Bitcoin truly represents. ",great divergence bitcoin hit alltime high $126k u government grind halt current shutdown unexpected catalyst forced many player look beyond volatility see bitcoin truly represents,positive,2,0.6427094119352537,1.0,positive,positive,positive,0.05149838530144968,0.30579222884032875,0.6427094119352537
1nzwj41,"Announcement: MyMonero is sunsetting, stewardship is transitioning to Cake Wallet",,PranksterGohan,2025-10-07 04:47:42,0,0.5,0,cryptomarkets,/r/Monero/comments/1nzq8p1/announcement_mymonero_is_sunsetting_stewardship/,https://reddit.com/r/CryptoMarkets/comments/1nzwj41/announcement_mymonero_is_sunsetting_stewardship/,False,,2025-10-10 15:07:36.899388,"Announcement: MyMonero is sunsetting, stewardship is transitioning to Cake Wallet ",announcement mymonero sunsetting stewardship transitioning cake wallet,neutral,1,0.9552715122699738,1.0,neutral,neutral,neutral,0.01023877877742052,0.9552715122699738,0.034489698708057404
1nz6gs8,Am I too diverse,"My Biweekly buys are $60 Bitcoin, $30 Eth, $30 Solana, $30 XRP, $30 Link, $15 XLM,
$15 Ondo, $10 Hbar, $10 XDC, $10 Algo, $10 Linea, $5 Doge. Am I too diverse in my buys? Be gentle….lol",GroundbreakingLab826,2025-10-06 08:49:31,7,0.99,9,cryptomarkets,https://www.reddit.com/r/CryptoMarkets/comments/1nz6gs8/am_i_too_diverse/,https://reddit.com/r/CryptoMarkets/comments/1nz6gs8/am_i_too_diverse/,True,,2025-10-10 15:07:36.899388,"Am I too diverse My Biweekly buys are $60 Bitcoin, $30 Eth, $30 Solana, $30 XRP, $30 Link, $15 XLM,
$15 Ondo, $10 Hbar, $10 XDC, $10 Algo, $10 Linea, $5 Doge. Am I too diverse in my buys? Be gentle….lol",too diverse biweekly buy $60 bitcoin $30 eth $30 solana $30 xrp $30 link $15 xlm $15 ondo $10 hbar $10 xdc $10 algo $10 linea $5 doge too diverse buy gentlelol,neutral,1,0.9494563639163971,1.0,neutral,neutral,neutral,0.008284986950457096,0.9494563639163971,0.04225864261388779
1nzbe19,Authentic store to buy a crypto cold wallet in Dubai?,,qwerty_0123456,2025-10-06 13:12:38,0,0.5,1,cryptomarkets,/r/dubai/comments/1nzbc5k/authentic_store_to_buy_a_crypto_cold_wallet_in/,https://reddit.com/r/CryptoMarkets/comments/1nzbe19/authentic_store_to_buy_a_crypto_cold_wallet_in/,False,Tool,2025-10-10 15:07:36.899388,Authentic store to buy a crypto cold wallet in Dubai? ,authentic store buy crypto cold wallet dubai,neutral,1,0.96596759557724,1.0,neutral,neutral,neutral,0.012509257532656193,0.96596759557724,0.021523136645555496
1nyo52b,"Remember those stimulus checks? Here's what you would have made if you invested that $3200 into Bitcoin: $BTC = $28,997.41 | We are in an investor economy.",,sylsau,2025-10-05 20:24:34,0,0.33,3,cryptomarkets,https://i.redd.it/wem5vnc6natf1.jpeg,https://reddit.com/r/CryptoMarkets/comments/1nyo52b/remember_those_stimulus_checks_heres_what_you/,False,DISCUSSION,2025-10-10 15:07:36.899388,"Remember those stimulus checks? Here's what you would have made if you invested that $3200 into Bitcoin: $BTC = $28,997.41 | We are in an investor economy. ",remember stimulus check here would made invested $3200 bitcoin $btc $2899741 investor economy,neutral,1,0.9538767039775848,1.0,neutral,neutral,neutral,0.008417405188083649,0.9538767039775848,0.03770587593317032
1nx8b01,Is Solana still #1 for memes?,I haven't traded in months and the last time I was trading Solana was the go to place for memes based on volume and trades. Is Solana still the go to place or is it another chain that took over? ,Creative310,2025-10-04 02:13:10,4,0.7,6,cryptomarkets,https://www.reddit.com/r/CryptoMarkets/comments/1nx8b01/is_solana_still_1_for_memes/,https://reddit.com/r/CryptoMarkets/comments/1nx8b01/is_solana_still_1_for_memes/,True,DISCUSSION,2025-10-10 15:07:36.899388,Is Solana still #1 for memes? I haven't traded in months and the last time I was trading Solana was the go to place for memes based on volume and trades. Is Solana still the go to place or is it another chain that took over? ,solana still 1 meme havent traded month last time trading solana go place meme based volume trade solana still go place another chain took,neutral,1,0.9577905833721161,1.0,neutral,neutral,neutral,0.017106767743825912,0.9577905833721161,0.025102639570832253
1nx2gfe,CleanSpark Releases September 2025 Bitcoin Mining Update,,SentimentSurfer,2025-10-03 22:35:31,2,1.0,1,cryptomarkets,/r/CleanSpark/comments/1nx2g0h/cleanspark_releases_september_2025_bitcoin_mining/,https://reddit.com/r/CryptoMarkets/comments/1nx2gfe/cleanspark_releases_september_2025_bitcoin_mining/,False,NEWS,2025-10-10 15:07:36.899388,CleanSpark Releases September 2025 Bitcoin Mining Update ,cleanspark release september 2025 bitcoin mining update,neutral,1,0.9743030965328217,1.0,neutral,neutral,neutral,0.012685741297900677,0.9743030965328217,0.01301120687276125
1gthc7a,Weekly DeFi discussion. What are your moves for this week?,What are you building or looking to take a position in? Let us know in the comments!,Oddsnotinyourfavor,2024-11-17 23:30:13,13,0.93,61,defi,https://www.reddit.com/r/defi/comments/1gthc7a/weekly_defi_discussion_what_are_your_moves_for/,https://reddit.com/r/defi/comments/1gthc7a/weekly_defi_discussion_what_are_your_moves_for/,True,,2025-10-10 15:07:40.020650,Weekly DeFi discussion. What are your moves for this week? What are you building or looking to take a position in? Let us know in the comments!,weekly defi discussion move week building looking take position let u know comment,neutral,1,0.9660457372665405,1.0,neutral,neutral,neutral,0.009994852356612682,0.9660457372665405,0.023959385231137276
1fxj3zr,Weekly DeFi discussion. What are your moves for this week?,What are you building or looking to take a position in? Let us know in the comments!,Oddsnotinyourfavor,2024-10-06 22:30:15,5,1.0,38,defi,https://www.reddit.com/r/defi/comments/1fxj3zr/weekly_defi_discussion_what_are_your_moves_for/,https://reddit.com/r/defi/comments/1fxj3zr/weekly_defi_discussion_what_are_your_moves_for/,True,,2025-10-10 15:07:40.020650,Weekly DeFi discussion. What are your moves for this week? What are you building or looking to take a position in? Let us know in the comments!,weekly defi discussion move week building looking take position let u know comment,neutral,1,0.9660457372665405,1.0,neutral,neutral,neutral,0.009994852356612682,0.9660457372665405,0.023959385231137276
1o2lvrh,Age verifying any account (any age usa only),"I can do every website that requires kyc

Gambaling

Paypal cashapp ect.

crypto exchanges

drug websites

Pm my telegram :@ joshsaq",TapFair3512,2025-10-10 06:56:43,0,0.5,0,defi,https://www.reddit.com/r/defi/comments/1o2lvrh/age_verifying_any_account_any_age_usa_only/,https://reddit.com/r/defi/comments/1o2lvrh/age_verifying_any_account_any_age_usa_only/,True,:ad: Self-Promo,2025-10-10 15:07:40.020650,"Age verifying any account (any age usa only) I can do every website that requires kyc

Gambaling

Paypal cashapp ect.

crypto exchanges

drug websites

Pm my telegram :@ joshsaq",age verifying account age usa every website requires kyc gambaling paypal cashapp ect crypto exchange drug website pm telegram joshsaq,neutral,1,0.9718480408191681,1.0,neutral,neutral,neutral,0.016420496627688408,0.9718480408191681,0.011731420643627644
1o0e3ln,SK Planet Acquires MOCA Coin to Power Decentralized Identity Network with Moca Network,,ProfitableCheetah,2025-10-07 19:59:52,28,1.0,5,defi,https://www.google.com/amp/s/thenewscrypto.com/sk-planet-acquires-moca-coin-to-power-decentralized-identity-network-with-moca-network/,https://reddit.com/r/defi/comments/1o0e3ln/sk_planet_acquires_moca_coin_to_power/,False,:news: News,2025-10-10 15:07:40.020650,SK Planet Acquires MOCA Coin to Power Decentralized Identity Network with Moca Network ,sk planet acquires moca coin power decentralized identity network moca network,neutral,1,0.9548388719558716,1.0,neutral,neutral,neutral,0.0056646657176315784,0.9548388719558716,0.03949641063809395
1nyr994,Weekly DeFi discussion. What are your moves for this week?,What are you building or looking to take a position in? Let us know in the comments!,Oddsnotinyourfavor,2025-10-05 22:30:37,2,1.0,10,defi,https://www.reddit.com/r/defi/comments/1nyr994/weekly_defi_discussion_what_are_your_moves_for/,https://reddit.com/r/defi/comments/1nyr994/weekly_defi_discussion_what_are_your_moves_for/,True,,2025-10-10 15:07:40.020650,Weekly DeFi discussion. What are your moves for this week? What are you building or looking to take a position in? Let us know in the comments!,weekly defi discussion move week building looking take position let u know comment,neutral,1,0.9660457372665405,1.0,neutral,neutral,neutral,0.009994852356612682,0.9660457372665405,0.023959385231137276
1nz5mbr,"Binance chain Krystal Defi vault earning good rewards avg 5,000% apy","aster/wbnb vault on auto-rebalance and auto-compound [https://defi.krystal.app/strategies/40028451?&utm\_source=copy\_link&utm\_medium=social\_sharing&utm\_campaign=Strategy\_share](https://defi.krystal.app/strategies/40028451?&utm_source=copy_link&utm_medium=social_sharing&utm_campaign=Strategy_share)

  
audit here - [https://docs.krystal.app/technical/security](https://docs.krystal.app/technical/security)

  
",yahboyelias,2025-10-06 08:08:31,0,0.25,3,defi,https://www.reddit.com/r/defi/comments/1nz5mbr/binance_chain_krystal_defi_vault_earning_good/,https://reddit.com/r/defi/comments/1nz5mbr/binance_chain_krystal_defi_vault_earning_good/,True,:ad: Self-Promo,2025-10-10 15:07:40.020650,"Binance chain Krystal Defi vault earning good rewards avg 5,000% apy aster/wbnb vault on auto-rebalance and auto-compound [https://defi.krystal.app/strategies/40028451?&utm\_source=copy\_link&utm\_medium=social\_sharing&utm\_campaign=Strategy\_share](https://defi.krystal.app/strategies/40028451?&utm_source=copy_link&utm_medium=social_sharing&utm_campaign=Strategy_share)

  
audit here - [https://docs.krystal.app/technical/security](https://docs.krystal.app/technical/security)

  
",binance chain krystal defi vault earning good reward avg 5000 apy aste vault autorebalance autocompound audit,positive,2,0.7203498742580414,1.0,positive,positive,positive,0.004484060686081648,0.2751660459637642,0.7203498742580414
1nxnx2n,What is decentralised in your terms ?,"In defi, why and what do you expect from defi ? Why would you invest in defi , what are  your expectations? ",0xc1pher,2025-10-04 14:49:07,9,1.0,9,defi,https://www.reddit.com/r/defi/comments/1nxnx2n/what_is_decentralised_in_your_terms/,https://reddit.com/r/defi/comments/1nxnx2n/what_is_decentralised_in_your_terms/,True,:discuss: Discussion,2025-10-10 15:07:40.020650,"What is decentralised in your terms ? In defi, why and what do you expect from defi ? Why would you invest in defi , what are  your expectations? ",decentralised term defi expect defi would invest defi expectation,neutral,1,0.9404378235340118,1.0,neutral,neutral,neutral,0.004612290300428867,0.9404378235340118,0.05494990199804306
1nve2jo,Moving SOL from Osmosis to Solana,"Is it possible to buy solana on osmosis and transfer them to the native solana network?

",on_zero,2025-10-02 00:09:04,3,0.81,5,defi,https://www.reddit.com/r/defi/comments/1nve2jo/moving_sol_from_osmosis_to_solana/,https://reddit.com/r/defi/comments/1nve2jo/moving_sol_from_osmosis_to_solana/,True,:crosschain: Cross-Chain,2025-10-10 15:07:40.020650,"Moving SOL from Osmosis to Solana Is it possible to buy solana on osmosis and transfer them to the native solana network?

",moving sol osmosis solana possible buy solana osmosis transfer native solana network,neutral,1,0.965975284576416,1.0,neutral,neutral,neutral,0.008222168311476707,0.965975284576416,0.02580253966152668
1nsr957,Weekly DeFi discussion. What are your moves for this week?,What are you building or looking to take a position in? Let us know in the comments!,Oddsnotinyourfavor,2025-09-28 22:30:36,8,1.0,11,defi,https://www.reddit.com/r/defi/comments/1nsr957/weekly_defi_discussion_what_are_your_moves_for/,https://reddit.com/r/defi/comments/1nsr957/weekly_defi_discussion_what_are_your_moves_for/,True,,2025-10-10 15:07:40.020650,Weekly DeFi discussion. What are your moves for this week? What are you building or looking to take a position in? Let us know in the comments!,weekly defi discussion move week building looking take position let u know comment,neutral,1,0.9660457372665405,1.0,neutral,neutral,neutral,0.009994852356612682,0.9660457372665405,0.023959385231137276
