post_id,title,content,author,created_utc,score,upvote_ratio,num_comments,subreddit,url,permalink,is_self,link_flair_text,collected_at,full_text,preprocessed_text,auto_label,auto_label_id,label_confidence,label_agreement,textblob_prediction,vader_prediction,finbert_prediction,score_negative,score_neutral,score_positive
1o29n18,Gold Holder vs Bitcoiner,Source: [https://x.com/naiivememe/status/1976232498310025578](https://x.com/naiivememe/status/1976232498310025578),kirtash93,2025-10-09 22:52:46,1219,0.87,153,cryptocurrency,https://i.redd.it/7fjwtvkey3uf1.png,https://reddit.com/r/CryptoCurrency/comments/1o29n18/gold_holder_vs_bitcoiner/,False,MEME,2025-10-10 15:07:26.257687,Gold Holder vs Bitcoiner Source: [https://x.com/naiivememe/status/1976232498310025578](https://x.com/naiivememe/status/1976232498310025578),gold holder v bitcoiner source,neutral,1,0.9628643989562988,1.0,neutral,neutral,neutral,0.013817167840898037,0.9628643989562988,0.023318421095609665
1o2du78,Which one of you is this,,Wise-Grapefruit-1443,2025-10-10 01:30:14,396,0.95,51,cryptocurrency,https://i.redd.it/o078aqgfv3uf1.jpeg,https://reddit.com/r/CryptoCurrency/comments/1o2du78/which_one_of_you_is_this/,False,DISCUSSION,2025-10-10 15:07:26.257687,Which one of you is this ,one,neutral,1,0.943106085062027,1.0,neutral,neutral,neutral,0.023481043055653572,0.943106085062027,0.03341288864612579
1o2pqvg,Governments weighing crypto reserves target $75 billion pot,,Dongerated,2025-10-10 10:02:26,43,0.93,3,cryptocurrency,https://fortune.com/crypto/2025/10/09/crypto-reserve-75-billion-bitcoin-ethereum-donald-trump/,https://reddit.com/r/CryptoCurrency/comments/1o2pqvg/governments_weighing_crypto_reserves_target_75/,False,GENERAL-NEWS,2025-10-10 15:07:26.257687,Governments weighing crypto reserves target $75 billion pot ,government weighing crypto reserve target $75 billion pot,neutral,1,0.9553853869438171,1.0,neutral,neutral,neutral,0.008418509736657143,0.9553853869438171,0.036196090281009674
1o2oz5y,"Alibaba founder’s Ethereum push, whales are 91% of Korean market",,Every_Hunt_160,2025-10-10 09:24:24,24,0.83,9,cryptocurrency,https://cointelegraph.com/magazine/alibaba-founder-ethereum-push-south-korea-whales-91-asia-express/,https://reddit.com/r/CryptoCurrency/comments/1o2oz5y/alibaba_founders_ethereum_push_whales_are_91_of/,False,🔴 UNRELIABLE SOURCE,2025-10-10 15:07:26.257687,"Alibaba founder’s Ethereum push, whales are 91% of Korean market ",alibaba founder ethereum push whale 91 korean market,neutral,1,0.9121198356151581,1.0,neutral,neutral,neutral,0.009990312159061432,0.9121198356151581,0.07788984477519989
1o257rh,Russia losing over $120 million a year in missing tax from crypto mining,,Abdeliq,2025-10-09 19:57:15,162,0.9,14,cryptocurrency,https://www.cryptopolitan.com/russia-losing-120m-in-tax-crypto-mining/,https://reddit.com/r/CryptoCurrency/comments/1o257rh/russia_losing_over_120_million_a_year_in_missing/,False,GENERAL-NEWS,2025-10-10 15:07:26.258680,Russia losing over $120 million a year in missing tax from crypto mining ,russia losing $120 million year missing tax crypto mining,negative,0,0.6494738324642182,1.0,negative,negative,negative,0.6494738324642182,0.3152154670000076,0.03531069681048393
1o2omla,BNB Chain Overtakes Ethereum And Solana In Cross-Chain Activity,,Green_Candler,2025-10-10 09:07:43,12,0.78,7,cryptocurrency,https://bitcoinist.com/bnb-chain-overtakes-ethereum-solana-chain-activity/,https://reddit.com/r/CryptoCurrency/comments/1o2omla/bnb_chain_overtakes_ethereum_and_solana_in/,False,🟢 GENERAL-NEWS,2025-10-10 15:07:26.258680,BNB Chain Overtakes Ethereum And Solana In Cross-Chain Activity ,bnb chain overtakes ethereum solana crosschain activity,neutral,1,0.927378922700882,1.0,neutral,neutral,neutral,0.004311153199523687,0.927378922700882,0.0683099776506424
1o23rsi,"Jack Dorsey's Square Unveils Bitcoin Payments, Wallet for Retailers - Decrypt",,DryMyBottom,2025-10-09 18:48:40,78,0.92,21,cryptocurrency,https://decrypt.co/343470/jack-dorseys-square-unveils-bitcoin-payments-wallet-retailers,https://reddit.com/r/CryptoCurrency/comments/1o23rsi/jack_dorseys_square_unveils_bitcoin_payments/,False,GENERAL-NEWS,2025-10-10 15:07:26.258680,"Jack Dorsey's Square Unveils Bitcoin Payments, Wallet for Retailers - Decrypt ",jack dorseys square unveils bitcoin payment wallet retailer decrypt,neutral,1,0.9626312851905823,1.0,neutral,neutral,neutral,0.02559490129351616,0.9626312851905823,0.011773782782256603
1o2b4dk,"Institutions Plan To Double Bitcoin And Crypto Exposure By 2028, State Street Research Finds",,KIG45,2025-10-09 23:47:39,35,0.93,4,cryptocurrency,https://bitcoinmagazine.com/business/institutions-plan-to-double-bitcoin-and-crypto-exposure-by-2028-state-street-research-finds,https://reddit.com/r/CryptoCurrency/comments/1o2b4dk/institutions_plan_to_double_bitcoin_and_crypto/,False,🟢 GENERAL-NEWS,2025-10-10 15:07:26.258680,"Institutions Plan To Double Bitcoin And Crypto Exposure By 2028, State Street Research Finds ",institution plan double bitcoin crypto exposure 2028 state street research find,neutral,1,0.9616110920906067,1.0,neutral,neutral,neutral,0.010037248954176903,0.9616110920906067,0.0283516738563776
1o2uebw,Peru's Largest Bank Partners with BitGo to Launch Crypto-Enabled Banking Platform 'Cryptococos',,rose98734,2025-10-10 14:26:55,1,1.0,1,cryptocurrency,https://inleo.io/@uyobong/perus-largest-bank-partners-with-bitgo-to-launch-cryptoenabled-banking-platform-cryptococos-3vi,https://reddit.com/r/CryptoCurrency/comments/1o2uebw/perus_largest_bank_partners_with_bitgo_to_launch/,False,GENERAL-NEWS,2025-10-10 15:07:26.258680,Peru's Largest Bank Partners with BitGo to Launch Crypto-Enabled Banking Platform 'Cryptococos' ,peru largest bank partner bitgo launch cryptoenabled banking platform cryptococos,neutral,1,0.9125722944736481,1.0,neutral,neutral,neutral,0.004395033232867718,0.9125722944736481,0.08303266763687134
1o1kbg7,Seat where all the strategies are brewed.,,Odd-Radio-8500,2025-10-09 02:25:43,697,0.98,21,cryptocurrency,https://i.redd.it/cnfoy0divxtf1.jpeg,https://reddit.com/r/CryptoCurrency/comments/1o1kbg7/seat_where_all_the_strategies_are_brewed/,False,MEME,2025-10-10 15:07:26.258680,Seat where all the strategies are brewed. ,seat strategy brewed,neutral,1,0.908141016960144,1.0,neutral,neutral,neutral,0.00741820503026247,0.908141016960144,0.08444077521562576
1o297nn,Ethereum doubles down on privacy with new ‘Kohaku’ wallet ahead of Devcon,,Every_Hunt_160,2025-10-09 22:36:32,15,0.68,2,cryptocurrency,https://cryptoslate.com/ethereum-doubles-down-on-privacy-with-new-kohaku-wallet-ahead-of-devcon/,https://reddit.com/r/CryptoCurrency/comments/1o297nn/ethereum_doubles_down_on_privacy_with_new_kohaku/,False,🟢 GENERAL-NEWS,2025-10-10 15:07:26.258680,Ethereum doubles down on privacy with new ‘Kohaku’ wallet ahead of Devcon ,ethereum double privacy new kohaku wallet ahead devcon,neutral,1,0.9401016533374786,1.0,neutral,neutral,neutral,0.0052659884095191956,0.9401016533374786,0.05463232472538948
1o27ifr,BNB Flips XRP to Become Third-Largest Crypto by Market Cap,,Next_Statement6145,2025-10-09 21:32:06,19,0.73,2,cryptocurrency,https://unchainedcrypto.com/bnb-flips-xrp-to-become-third-largest-crypto-by-market-cap/,https://reddit.com/r/CryptoCurrency/comments/1o27ifr/bnb_flips_xrp_to_become_thirdlargest_crypto_by/,False,GENERAL-NEWS,2025-10-10 15:07:26.258680,BNB Flips XRP to Become Third-Largest Crypto by Market Cap ,bnb flip xrp become thirdlargest crypto market cap,neutral,1,0.8932143151760101,1.0,neutral,neutral,neutral,0.0062980265356600285,0.8932143151760101,0.10048766434192657
1o2oi1y,AVAX One: Bridging Wall Street and Web3 With a $550M Investment on Avalanche,,renkure,2025-10-10 09:01:38,2,0.67,2,cryptocurrency,https://peakd.com/@joseph23/avax-one-bridging-wall-street,https://reddit.com/r/CryptoCurrency/comments/1o2oi1y/avax_one_bridging_wall_street_and_web3_with_a/,False,GENERAL-NEWS,2025-10-10 15:07:26.258680,AVAX One: Bridging Wall Street and Web3 With a $550M Investment on Avalanche ,avax one bridging wall street web3 $550m investment avalanche,neutral,1,0.7483292520046234,1.0,neutral,neutral,neutral,0.005218401085585356,0.7483292520046234,0.24645234644412994
1o2nhmd,Anichess: Pudgy Takeover,,tupidataba,2025-10-10 08:12:45,2,0.67,1,cryptocurrency,https://docs.anichess.com/anichess/current-events/pudgy-takeover,https://reddit.com/r/CryptoCurrency/comments/1o2nhmd/anichess_pudgy_takeover/,False,NFTs,2025-10-10 15:07:26.258680,Anichess: Pudgy Takeover ,anichess pudgy takeover,neutral,1,0.9181904196739197,1.0,neutral,neutral,neutral,0.027110816910862923,0.9181904196739197,0.05469876155257225
1o1gtyr,Deutsche Bank predicts Central Banks may hold Bitcoin by 2030 in historic shift,,CriticalCobraz,2025-10-09 00:23:04,120,0.95,14,cryptocurrency,https://regtechtimes.com/bitcoin-may-join-gold-as-a-central-bank-reserve/,https://reddit.com/r/CryptoCurrency/comments/1o1gtyr/deutsche_bank_predicts_central_banks_may_hold/,False,SPECULATION,2025-10-10 15:07:26.258680,Deutsche Bank predicts Central Banks may hold Bitcoin by 2030 in historic shift ,deutsche bank predicts central bank may hold bitcoin 2030 historic shift,neutral,1,0.8495283424854279,1.0,neutral,neutral,neutral,0.07989606261253357,0.8495283424854279,0.07057560980319977
1o1da0m,"$11B Bitcoin Whale Returns After 2 Months, Transfers $360M BTC",,ChemicalAnybody6229,2025-10-08 22:13:51,93,0.91,17,cryptocurrency,https://cointelegraph.com/news/11b-bitcoin-whale-returns-360m-btc-transfer,https://reddit.com/r/CryptoCurrency/comments/1o1da0m/11b_bitcoin_whale_returns_after_2_months/,False,🔴 UNRELIABLE SOURCE,2025-10-10 15:07:26.258680,"$11B Bitcoin Whale Returns After 2 Months, Transfers $360M BTC ",$11b bitcoin whale return 2 month transfer $360m btc,neutral,1,0.9532849490642548,1.0,neutral,neutral,neutral,0.006533854641020298,0.9532849490642548,0.04018121212720871
1o28frb,North Dakota Issuing Roughrider Stablecoin,,davideownzall,2025-10-09 22:07:39,2,0.62,2,cryptocurrency,https://ecency.com/hive-167922/@taskmaster4450/north-dakota-issuing-roughrider-stablecoin-3eg,https://reddit.com/r/CryptoCurrency/comments/1o28frb/north_dakota_issuing_roughrider_stablecoin/,False,GENERAL-NEWS,2025-10-10 15:07:26.258680,North Dakota Issuing Roughrider Stablecoin ,north dakota issuing roughrider stablecoin,neutral,1,0.9533647000789642,1.0,neutral,neutral,neutral,0.007939500734210014,0.9533647000789642,0.03869575262069702
1o2cmkz,AMINA Bank Introduces Regulated Polygon (POL) Staking for Institutions,,0xpolygonlabs,2025-10-10 00:44:17,0,0.2,1,cryptocurrency,https://polygon.technology/blog/amina-bank-introduces-regulated-polygon-pol-staking-for-institutions,https://reddit.com/r/CryptoCurrency/comments/1o2cmkz/amina_bank_introduces_regulated_polygon_pol/,False,GENERAL-NEWS,2025-10-10 15:07:26.258680,AMINA Bank Introduces Regulated Polygon (POL) Staking for Institutions ,amina bank introduces regulated polygon pol staking institution,neutral,1,0.9552793800830841,1.0,neutral,neutral,neutral,0.007862717844545841,0.9552793800830841,0.03685790300369263
1o1lc4f,"Ethereum Foundation to launch privacy cluster, including Kohaku wallet and privacy SDK",,kirtash93,2025-10-09 02:58:09,18,0.88,5,cryptocurrency,https://www.cryptopolitan.com/ethereum-foundation-to-launch-privacy-cluster-including-kohaku-wallet-and-privacy-sdk/,https://reddit.com/r/CryptoCurrency/comments/1o1lc4f/ethereum_foundation_to_launch_privacy_cluster/,False,GENERAL-NEWS,2025-10-10 15:07:26.258680,"Ethereum Foundation to launch privacy cluster, including Kohaku wallet and privacy SDK ",ethereum foundation launch privacy cluster including kohaku wallet privacy sdk,neutral,1,0.9129907488822937,1.0,neutral,neutral,neutral,0.003968739882111549,0.9129907488822937,0.08304053544998169
1o1ru9m,"MetaMask taps Hyperliquid, Polymarket as crypto wallet provider morphs into trading app",,GreedVault,2025-10-09 07:21:21,2,0.63,3,cryptocurrency,https://www.dlnews.com/articles/defi/metamask-integrates-hyperliquid-and-polymarket-for-mobile/,https://reddit.com/r/CryptoCurrency/comments/1o1ru9m/metamask_taps_hyperliquid_polymarket_as_crypto/,False,GENERAL-NEWS,2025-10-10 15:07:26.258680,"MetaMask taps Hyperliquid, Polymarket as crypto wallet provider morphs into trading app ",metamask tap hyperliquid polymarket crypto wallet provider morphs trading app,neutral,1,0.9661251902580261,1.0,neutral,neutral,neutral,0.006158751901239157,0.9661251902580261,0.02771606482565403
1o0xs0z,Crypto’s Retail Era Is Over: Institutions Now Set the Market’s Pace,,GreedVault,2025-10-08 08:45:08,108,0.93,17,cryptocurrency,https://decrypt.co/343350/cryptos-retail-era-over-institutions-set-markets-pace-experts,https://reddit.com/r/CryptoCurrency/comments/1o0xs0z/cryptos_retail_era_is_over_institutions_now_set/,False,GENERAL-NEWS,2025-10-10 15:07:26.258680,Crypto’s Retail Era Is Over: Institutions Now Set the Market’s Pace ,cryptos retail era institution set market pace,neutral,1,0.910000205039978,1.0,neutral,neutral,neutral,0.00929789524525404,0.910000205039978,0.08070190250873566
1o10kcx,BlackRock Bitcoin ETF Nears $100 Billion AUM Milestone 👀,,Funnyurolith61,2025-10-08 11:05:16,30,0.92,7,cryptocurrency,https://coinstats.app/news/e2876d00df322f442f97315b4b4891706eb33e9a9b911e0a6f633f51ebbc1102_BlackRock-Bitcoin-ETF-Nears-%24100-Billion-AUM-Milestone/,https://reddit.com/r/CryptoCurrency/comments/1o10kcx/blackrock_bitcoin_etf_nears_100_billion_aum/,False,ANALYSIS,2025-10-10 15:07:26.258680,BlackRock Bitcoin ETF Nears $100 Billion AUM Milestone 👀 ,blackrock bitcoin etf nears $100 billion aum milestone,neutral,1,0.794791579246521,1.0,neutral,neutral,neutral,0.020294860005378723,0.794791579246521,0.1849135458469391
1nzyh5p,Which one is it?,,OfficialBONKfun,2025-10-07 06:08:13,6283,0.94,210,cryptocurrency,https://i.redd.it/54a5za3dpktf1.png,https://reddit.com/r/CryptoCurrency/comments/1nzyh5p/which_one_is_it/,False,DEBATE,2025-10-10 15:07:26.258680,Which one is it? ,one,neutral,1,0.943106085062027,1.0,neutral,neutral,neutral,0.023481043055653572,0.943106085062027,0.03341288864612579
1o0o8d3,"Bitcoin: The Path to $150,000 Becomes Clearer",,KIG45,2025-10-08 02:13:36,79,0.81,37,cryptocurrency,https://www.cointribune.com/en/bitcoin-the-road-to-150000-clears/,https://reddit.com/r/CryptoCurrency/comments/1o0o8d3/bitcoin_the_path_to_150000_becomes_clearer/,False,GENERAL-NEWS,2025-10-10 15:07:26.258680,"Bitcoin: The Path to $150,000 Becomes Clearer ",bitcoin path $150000 becomes clearer,neutral,1,0.9494377970695496,1.0,neutral,neutral,neutral,0.025807920843362808,0.9494377970695496,0.024754304438829422
1o0hhou,Senator Lummis Says US Bitcoin Reserve Funding Can Begin ‘Anytime’,,diwalost,2025-10-07 22:11:27,124,0.91,42,cryptocurrency,https://finance.yahoo.com/news/senator-lummis-says-us-bitcoin-134035796.html?guccounter=1&guce_referrer=aHR0cHM6Ly93d3cuZ29vZ2xlLmNvbS8&guce_referrer_sig=AQAAAB5MhGS5FrAA5riEQQhnGcejvkrqV9_3pTQ0RqgRLpEWGCONKrFG9Z1fl0SMXanrqRwnR9i9FZyZRa9RjJMtsdSiGGUU1G6WhHnzP1qWXMqXxEpi9ZXeIJTe16duH-EThivoPa-XO5IyBLl2W2qThAvcG3ZA3OjO_nhoNP01NNRW,https://reddit.com/r/CryptoCurrency/comments/1o0hhou/senator_lummis_says_us_bitcoin_reserve_funding/,False,GENERAL-NEWS,2025-10-10 15:07:26.258680,Senator Lummis Says US Bitcoin Reserve Funding Can Begin ‘Anytime’ ,senator lummis say u bitcoin reserve funding begin anytime,neutral,1,0.8719688951969147,1.0,neutral,neutral,neutral,0.009881585836410522,0.8719688951969147,0.1181495264172554
1o1dlap,Kaspa zkevm erc20 bridge,,90Skill10Luck,2025-10-08 22:25:05,0,0.46,7,cryptocurrency,/r/kaspa/comments/1o1dkr2/kaspa_zkevm_erc20_bridge/,https://reddit.com/r/CryptoCurrency/comments/1o1dlap/kaspa_zkevm_erc20_bridge/,False,DISCUSSION,2025-10-10 15:07:26.258680,Kaspa zkevm erc20 bridge ,kaspa zkevm erc20 bridge,neutral,1,0.9513964056968689,1.0,neutral,neutral,neutral,0.009653993882238865,0.9513964056968689,0.03894960880279541
1o0jbmu,You could say he's a BTC Econo-miss,,002_timmy,2025-10-07 23:18:35,57,0.8,38,cryptocurrency,https://i.redd.it/814qboj4tptf1.png,https://reddit.com/r/CryptoCurrency/comments/1o0jbmu/you_could_say_hes_a_btc_economiss/,False,LEGACY,2025-10-10 15:07:26.258680,You could say he's a BTC Econo-miss ,could say he btc economiss,neutral,1,0.9565133452415466,1.0,neutral,neutral,neutral,0.008426538668572903,0.9565133452415466,0.035060085356235504
1o2ecds,Bitcoin ad on the front page of the Times of India!,,Jeovanni98,2025-10-10 01:49:23,788,0.98,22,bitcoin,https://i.redd.it/hhtnwzjtt4uf1.png,https://reddit.com/r/Bitcoin/comments/1o2ecds/bitcoin_ad_on_the_front_page_of_the_times_of_india/,False,,2025-10-10 15:07:29.815122,Bitcoin ad on the front page of the Times of India! ,bitcoin ad front page time india,neutral,1,0.9655091464519501,1.0,neutral,neutral,neutral,0.023366732522845268,0.9655091464519501,0.011124140582978725
1o2e64z,Not f*cking selling,,InfinityLife,2025-10-10 01:42:44,643,0.92,154,bitcoin,https://v.redd.it/lpwp2cxos4uf1,https://reddit.com/r/Bitcoin/comments/1o2e64z/not_fcking_selling/,False,,2025-10-10 15:07:29.815122,Not f*cking selling ,not fcking selling,neutral,1,0.9672200381755829,1.0,neutral,neutral,neutral,0.015006453730165958,0.9672200381755829,0.017773497849702835
1o2fxyl,Someone check up on him,,Available_Reveal4066,2025-10-10 02:51:09,513,0.94,47,bitcoin,https://i.redd.it/70tzsgkx45uf1.png,https://reddit.com/r/Bitcoin/comments/1o2fxyl/someone_check_up_on_him/,False,,2025-10-10 15:07:29.815122,Someone check up on him ,someone check,neutral,1,0.905965268611908,1.0,neutral,neutral,neutral,0.06175090745091438,0.905965268611908,0.03228381648659706
1o29702,Which one of you is this,,alancarroII,2025-10-09 22:35:52,681,0.96,155,bitcoin,https://i.redd.it/o078aqgfv3uf1.jpeg,https://reddit.com/r/Bitcoin/comments/1o29702/which_one_of_you_is_this/,False,,2025-10-10 15:07:29.815122,Which one of you is this ,one,neutral,1,0.943106085062027,1.0,neutral,neutral,neutral,0.023481043055653572,0.943106085062027,0.03341288864612579
1o245wk,Oof,,TheUnholyMoly,2025-10-09 19:08:17,964,0.95,48,bitcoin,https://i.redd.it/hejq0h5eu2uf1.jpeg,https://reddit.com/r/Bitcoin/comments/1o245wk/oof/,False,,2025-10-10 15:07:29.815122,Oof ,oof,neutral,1,0.9434098303318024,1.0,neutral,neutral,neutral,0.0352010615170002,0.9434098303318024,0.021389098837971687
1o2jr5o,Our Time is Coming,,Maximum-Writing5429,2025-10-10 05:21:05,119,0.94,11,bitcoin,https://i.redd.it/2lj1x2elv5uf1.png,https://reddit.com/r/Bitcoin/comments/1o2jr5o/our_time_is_coming/,False,,2025-10-10 15:07:29.815122,Our Time is Coming ,time coming,neutral,1,0.9493736624717712,1.0,neutral,neutral,neutral,0.02322317846119404,0.9493736624717712,0.027403172105550766
1o2tr0a,bitcoin lifestyle,,joex2021,2025-10-10 13:46:12,6,0.88,1,bitcoin,https://i.redd.it/q5gu7cghd8uf1.png,https://reddit.com/r/Bitcoin/comments/1o2tr0a/bitcoin_lifestyle/,False,,2025-10-10 15:07:29.815122,bitcoin lifestyle ,bitcoin lifestyle,neutral,1,0.9715730845928192,1.0,neutral,neutral,neutral,0.016525300219655037,0.9715730845928192,0.01190163567662239
1o1zb99,just in case you forgot,"dca, buy the dip, and never sell.",Bubbly_Ice3836,2025-10-09 14:07:25,407,0.96,63,bitcoin,https://i.redd.it/a0s179spc1uf1.jpeg,https://reddit.com/r/Bitcoin/comments/1o1zb99/just_in_case_you_forgot/,False,,2025-10-10 15:07:29.815122,"just in case you forgot dca, buy the dip, and never sell.",case forgot dca buy dip never sell,neutral,1,0.9483544230461121,1.0,neutral,neutral,neutral,0.037617869675159454,0.9483544230461121,0.014027697965502739
1o24kyk,Square Launches Bitcoin Retail Payments for Local Merchants,,renkure,2025-10-09 19:28:39,19,0.81,1,bitcoin,https://ecency.com/@uyobong/square-launches-bitcoin-retail-payments-for-local-merchants-4ox,https://reddit.com/r/Bitcoin/comments/1o24kyk/square_launches_bitcoin_retail_payments_for_local/,False,,2025-10-10 15:07:29.815122,Square Launches Bitcoin Retail Payments for Local Merchants ,square launch bitcoin retail payment local merchant,neutral,1,0.9731031954288483,1.0,neutral,neutral,neutral,0.009525509551167488,0.9731031954288483,0.01737128011882305
1o1sa9u,JUST IN: World's largest prediction platform Polymarket now allows users to directly deposit Bitcoin.,,BitCypher84,2025-10-09 07:42:31,158,0.96,8,bitcoin,https://i.redd.it/7u6onwu0gztf1.png,https://reddit.com/r/Bitcoin/comments/1o1sa9u/just_in_worlds_largest_prediction_platform/,False,,2025-10-10 15:07:29.815122,JUST IN: World's largest prediction platform Polymarket now allows users to directly deposit Bitcoin. ,world largest prediction platform polymarket allows user directly deposit bitcoin,neutral,1,0.96087646484375,1.0,neutral,neutral,neutral,0.005418321117758751,0.96087646484375,0.03370523452758789
1o1h0i1,$622.15,,OkHighlight5458,2025-10-09 00:29:41,253,0.95,24,bitcoin,https://v.redd.it/gjmfve5raxtf1,https://reddit.com/r/Bitcoin/comments/1o1h0i1/62215/,False,,2025-10-10 15:07:29.815122,$622.15 ,$62215,neutral,1,0.9639583826065063,1.0,neutral,neutral,neutral,0.0142691470682621,0.9639583826065063,0.02177242748439312
1o28z0g,Buying bitcoin hassle?,"Why is buying bitcoin such a hassle. Im in Oman, so Card isn't working, PayPal isn't working. Would sites like eToro really be a bad idea? 😅",AaminaOman,2025-10-09 22:27:29,0,0.45,8,bitcoin,https://www.reddit.com/r/Bitcoin/comments/1o28z0g/buying_bitcoin_hassle/,https://reddit.com/r/Bitcoin/comments/1o28z0g/buying_bitcoin_hassle/,True,,2025-10-10 15:07:29.815122,"Buying bitcoin hassle? Why is buying bitcoin such a hassle. Im in Oman, so Card isn't working, PayPal isn't working. Would sites like eToro really be a bad idea? 😅",buying bitcoin hassle buying bitcoin hassle im oman so card isnt working paypal isnt working would site like etoro really bad idea,negative,0,0.7019909877300262,1.0,negative,negative,negative,0.7019909877300262,0.2645246036529541,0.033484395578503606
1o0pxss,When your family finally asks what you’ve been doing since 2017 😅,,Legitimate_Towel_919,2025-10-08 03:16:42,2005,0.99,42,bitcoin,https://i.redd.it/ekzu0repzqtf1.jpeg,https://reddit.com/r/Bitcoin/comments/1o0pxss/when_your_family_finally_asks_what_youve_been/,False,,2025-10-10 15:07:29.815122,When your family finally asks what you’ve been doing since 2017 😅 ,family finally asks youve since 2017,neutral,1,0.9069292545318604,1.0,neutral,neutral,neutral,0.0549582876265049,0.9069292545318604,0.03811245039105415
1o12i9y,Deutsche Bank predicts central banks may hold bitcoin by 2030 in historic shift,,Smooth_Top7902,2025-10-08 12:56:49,212,0.98,18,bitcoin,https://regtechtimes.com/bitcoin-may-join-gold-as-a-central-bank-reserve/,https://reddit.com/r/Bitcoin/comments/1o12i9y/deutsche_bank_predicts_central_banks_may_hold/,False,,2025-10-10 15:07:29.815122,Deutsche Bank predicts central banks may hold bitcoin by 2030 in historic shift ,deutsche bank predicts central bank may hold bitcoin 2030 historic shift,neutral,1,0.8495283424854279,1.0,neutral,neutral,neutral,0.07989606261253357,0.8495283424854279,0.07057560980319977
1o2nlcg,"All Core Devs - Execution (ACDE) #222: 
🦓 Fusaka upgrade: ✅ Holešky testnet BPO1 ✅ Sepolia testnet shadow fork
🌠 Glamsterdam upgrade: 🔲 EIP7928 Block-level Access Lists (BALs): 🔜 devnet-0, 🧪 80% of tests passing; 🗳️ Proposed non-headliner EIPs: presentations",,abcoathup,2025-10-10 08:17:50,8,0.79,0,ethereum,https://ethereum-magicians.org/t/all-core-devs-execution-acde-222-october-9-2025/25624/2,https://reddit.com/r/ethereum/comments/1o2nlcg/all_core_devs_execution_acde_222_fusaka_upgrade/,False,Protocol call,2025-10-10 15:07:33.360526,"All Core Devs - Execution (ACDE) #222: 
🦓 Fusaka upgrade: ✅ Holešky testnet BPO1 ✅ Sepolia testnet shadow fork
🌠 Glamsterdam upgrade: 🔲 EIP7928 Block-level Access Lists (BALs): 🔜 devnet-0, 🧪 80% of tests passing; 🗳️ Proposed non-headliner EIPs: presentations ",core devs execution acde 222 fusaka upgrade holeky testnet bpo1 sepolia testnet shadow fork glamsterdam upgrade eip7928 blocklevel access list bals devnet0 80 test passing proposed nonheadliner eips presentation,neutral,1,0.9546359181404114,1.0,neutral,neutral,neutral,0.006348839495331049,0.9546359181404114,0.03901524841785431
1ny5fyd,Building Democranet: A Permissionless On-Chain Voting Protocol for DAOs,,mudgen,2025-10-05 04:02:22,19,0.83,5,ethereum,https://nickmudge.com/plans-for-building-democranet,https://reddit.com/r/ethereum/comments/1ny5fyd/building_democranet_a_permissionless_onchain/,False,,2025-10-10 15:07:33.360526,Building Democranet: A Permissionless On-Chain Voting Protocol for DAOs ,building democranet permissionless onchain voting protocol daos,neutral,1,0.9689249098300934,1.0,neutral,neutral,neutral,0.00664479099214077,0.9689249098300934,0.0244302935898304
1nx3jhg,Tokenized stocks and self custody,"If a stock is tokenized on ethereum, what role does DTC have? If the token is sold to another EOA, does the DTC get notification of a change of ownership of the stock?",Robru3142,2025-10-03 23:15:34,10,1.0,9,ethereum,https://www.reddit.com/r/ethereum/comments/1nx3jhg/tokenized_stocks_and_self_custody/,https://reddit.com/r/ethereum/comments/1nx3jhg/tokenized_stocks_and_self_custody/,True,,2025-10-10 15:07:33.360526,"Tokenized stocks and self custody If a stock is tokenized on ethereum, what role does DTC have? If the token is sold to another EOA, does the DTC get notification of a change of ownership of the stock?",tokenized stock self custody stock tokenized ethereum role dtc token sold another eoa dtc get notification change ownership stock,neutral,1,0.9732730686664581,1.0,neutral,neutral,neutral,0.007981053553521633,0.9732730686664581,0.01874585822224617
